[
  {
    "id": "dict-lisan-al-arab",
    "title": "لسان العرب",
    "author": "ابن منظور",
    "category": "dictionary",
    "source_type": "html",
    "language_stage": "classical",
    "status": "synthesized",
    "original_url": "https://ar.wikisource.org/wiki/%D9%84%D8%B3%D8%A7%D9%86_%D8%A7%D9%84%D8%B9%D8%B1%D8%A8",
    "mirror_urls": [
      "https://ar.wikisource.org/wiki/%D9%84%D8%B3%D8%A7%D9%86_%D8%A7%D9%84%D8%B9%D8%B1%D8%A8/%D8%AD%D8%B1%D9%81_%D8%A7%D9%84%D8%A8%D8%A7%D8%A1",
      "https://ar.wikisource.org/wiki/%D9%84%D8%B3%D8%A7%D9%86_%D8%A7%D9%84%D8%B9%D8%B1%D8%A8/%D8%A8%D9%8A%D9%86-",
      "https://ar.wikisource.org/wiki/%D9%84%D8%B3%D8%A7%D9%86_%D8%A7%D9%84%D8%B9%D8%B1%D8%A8/%D8%A8%D8%A7%D8%A1-",
      "https://ar.wikisource.org/wiki/%D9%84%D8%B3%D8%A7%D9%86_%D8%A7%D9%84%D8%B9%D8%B1%D8%A8/%D9%81%D8%A3%D9%81%D8%A3_-",
      "https://ar.wikisource.org/wiki/%D9%84%D8%B3%D8%A7%D9%86_%D8%A7%D9%84%D8%B9%D8%B1%D8%A8/%D8%AD%D8%B1%D9%81_%D8%A7%D9%84%D9%88%D8%A7%D9%88",
      "https://ar.wikisource.org/wiki/%D9%84%D8%B3%D8%A7%D9%86_%D8%A7%D9%84%D8%B9%D8%B1%D8%A8/%D9%82%D8%A8%D8%A3_-",
      "https://ar.wikisource.org/wiki/%D9%84%D8%B3%D8%A7%D9%86_%D8%A7%D9%84%D8%B9%D8%B1%D8%A8/%D9%82%D9%84%D9%81_-",
      "https://ar.wikisource.org/wiki/%D9%84%D8%B3%D8%A7%D9%86_%D8%A7%D9%84%D8%B9%D8%B1%D8%A8/%D9%82%D8%B1%D8%A8%D8%B6_-",
      "https://ar.wikisource.org/wiki/%D9%84%D8%B3%D8%A7%D9%86_%D8%A7%D9%84%D8%B9%D8%B1%D8%A8/%D9%84%D8%A7%D9%85_-",
      "https://ar.wikisource.org/wiki/%D9%84%D8%B3%D8%A7%D9%86_%D8%A7%D9%84%D8%B9%D8%B1%D8%A8/%D9%84%D8%BA%D8%B7_-",
      "https://ar.wikisource.org/wiki/%D9%84%D8%B3%D8%A7%D9%86_%D8%A7%D9%84%D8%B9%D8%B1%D8%A8/%D9%86%D9%88%D9%86",
      "https://ar.wikisource.org/wiki/%D9%84%D8%B3%D8%A7%D9%86_%D8%A7%D9%84%D8%B9%D8%B1%D8%A8/%D9%86%D8%A8%D9%83_-_%D9%86%D9%82%D9%85",
      "https://ar.wikisource.org/wiki/%D9%84%D8%B3%D8%A7%D9%86%20%D8%A7%D9%84%D8%B9%D8%B1%D8%A8/%D8%A3%D8%A8%D8%A7-%D8%A3%D8%B5%D8%B1",
      "https://ar.wikisource.org/wiki/%D9%84%D8%B3%D8%A7%D9%86%20%D8%A7%D9%84%D8%B9%D8%B1%D8%A8/%D8%A3%D8%A8%D8%A7-%D8%A3%D9%85%D8%B3",
      "https://ar.wikisource.org/wiki/%D9%84%D8%B3%D8%A7%D9%86%20%D8%A7%D9%84%D8%B9%D8%B1%D8%A8/%D8%A3%D8%A8%D9%86-%D8%A3%D8%A8%D9%8A",
      "https://ar.wikisource.org/wiki/%D9%84%D8%B3%D8%A7%D9%86%20%D8%A7%D9%84%D8%B9%D8%B1%D8%A8/%D8%A3%D8%AA%D9%8A-%D8%A3%D9%8A%D8%A7",
      "https://ar.wikisource.org/wiki/%D9%84%D8%B3%D8%A7%D9%86%20%D8%A7%D9%84%D8%B9%D8%B1%D8%A8/%D8%A3%D8%B7%D8%B1-%D8%A3%D9%84%D9%84",
      "https://ar.wikisource.org/wiki/%D9%84%D8%B3%D8%A7%D9%86%20%D8%A7%D9%84%D8%B9%D8%B1%D8%A8/%D8%A3%D9%85%D9%84-%D8%A3%D9%8A%D9%85"
    ],
    "publisher": "Wikisource contributors",
    "year": null,
    "notes": "معجم محوري لتتبع الألفاظ والاستعمالات الفصيحة. صُحِّح في هذا المشروع وضع الاقتناء السابق: الملف `data/raw/dict-lisan-al-arab.wikitext.txt` ليس إلا صفحة الفهرس/المدخل التي تجمع روابط الحروف، ولا يمثل متن المعجم. أُنجز اقتناء فعلي سابقاً عبر صفحة الجذر `لسان العرب/بين-`، ثم عبر صفحات حقيقية إضافية من المتن (`لسان العرب/باء-` و`لسان العرب/فأفأ -`)، ثم عبر صفحة `لسان العرب/حرف الواو` الكاملة. بعد ذلك جرى توسيع الأساس المعجمي بدفعة خام أكبر وأعرض من الصفحات الصغيرة المنفردة: سبع صفحات فعلية جديدة من متن المعجم (`قبأ -`، `قلف -`، `قربض -`، `لام -`، `لغط -`، `نون`، `نبك - نقم`) جُمعت في batch واحد يتجاوز 2.8 ميغابايت قبل التنظيف. وفي هذه الدفعة الحالية أضيف batch خام جديد كبير من عنقود الألف يضم ست صفحات فعلية من المتن (`أبا-أصر`، `أبا-أمس`، `أبن-أبي`، `أتي-أيا`، `أطر-ألل`، `أمل-أيم`) بحجم يقارب 2.08 ميغابايت. استُخرج منه ملف نصي واسع يركز على جذور تأسيسية تخدم الأدب والأمانة والأهلية ومنهج الإتيان من المأتى الصحيح (`أدب`، `أرب`، `أثر`، `أصر`، `أمن`، `أبي`، `أتي`، `أمر`، `أصل`، `أمل`، `أهل`)، ثم أُضيفت فائدته في وحدة Markdown جديدة داخل الملف الموحّد للمصدر. هذا العمل مبني على محتوى معجمي حقيقي من صفحات المتن لا على صفحة الفهرس، ويعطي المشروع تغطية أوسع عبر جذور متعددة وموضوعات استعمالية متباينة؛ ومع ذلك تبقى التغطية جزئية جداً بالنسبة إلى لسان العرب كله.",
    "license": "Underlying work public domain; Wikisource transcription available under CC BY-SA 4.0.",
    "raw_file": "data/raw/dict-lisan-al-arab-alif-cluster-writing-foundations.wikitext.txt",
    "text_file": "data/text/dict-lisan-al-arab-alif-cluster-foundational-roots.txt",
    "markdown_outputs": [
      "data/markdown/dict-lisan-al-arab-complete-writing-foundations.md"
    ],
    "duplicate_keys": {
      "normalized_title": "لسان العرب",
      "normalized_author": "ابن منظور",
      "content_sha256": "f07b15bde2f0ce4b04126b05de1f978181aa183886a9a4f0b2a70e21e0613074"
    },
    "provenance": {
      "discovered_at": "2026-05-21",
      "discovery_method": "قائمة تأسيسية يدوية؛ تحقق عبر واجهة ويكي مصدر API",
      "verified_by": "Hermes"
    }
  },
  {
    "id": "dict-al-qamus-al-muhit",
    "title": "القاموس المحيط",
    "author": "مجد الدين الفيروزآبادي",
    "category": "dictionary",
    "source_type": "html",
    "language_stage": "classical",
    "status": "synthesized",
    "original_url": "https://ar.wikisource.org/wiki/%D8%A7%D9%84%D9%82%D8%A7%D9%85%D9%88%D8%B3_%D8%A7%D9%84%D9%85%D8%AD%D9%8A%D8%B7",
    "mirror_urls": [
      "https://ar.wikisource.org/wiki/%D8%A7%D9%84%D9%82%D8%A7%D9%85%D9%88%D8%B3_%D8%A7%D9%84%D9%85%D8%AD%D9%8A%D8%B7/%D9%85%D9%82%D8%AF%D9%85%D8%A9_%D8%A7%D9%84%D9%85%D8%A4%D9%84%D9%81",
      "https://ar.wikisource.org/wiki/%D8%A7%D9%84%D9%82%D8%A7%D9%85%D9%88%D8%B3_%D8%A7%D9%84%D9%85%D8%AD%D9%8A%D8%B7/%D8%A8%D8%A7%D8%A8_%D8%A7%D9%84%D9%87%D9%85%D8%B2%D8%A9"
    ],
    "publisher": "Wikisource contributors",
    "year": null,
    "notes": "أُنجزت في هذه الدفعة أول طبقة عمل حقيقية من القاموس المحيط عبر جمع صفحتين كاملتين من النص الرقمي المتاح على ويكي مصدر: مقدمة المؤلف وباب الهمزة. جُمعت الصفحتان في raw batch واحد أكبر من الجذور المنفردة الصغيرة، ثم نُظِّمت المادة في ملف نصي يوزع الفائدة على مبادئ صناعة المعجم والاختصار، وعلى عناقيد لفظية عملية تخدم التثبت، والمران والتهاون، والبطء والإبطاء، والرجوع والإقرار والتبوئة. ثم صيغت منها ثلاث حزم Markdown متوسطة الغنى بدل ملف واحد ضيق حول جذر مفرد. هذه التغطية لا تزال جزئية بالنسبة إلى المعجم كله، لكنها تمنح المشروع أول دفعة حقيقية من القاموس المحيط نفسه وتوسع الأساس المعجمي بمصدر جديد لا يكرر الدفعات الأخيرة من لسان العرب.",
    "license": "Underlying work public domain; Wikisource transcription available under CC BY-SA 4.0.",
    "raw_file": "data/raw/dict-al-qamus-al-muhit-muqaddima-and-bab-al-hamza.wikitext.txt",
    "text_file": "data/text/dict-al-qamus-al-muhit-foundations-from-muqaddima-and-bab-al-hamza.txt",
    "markdown_outputs": [
      "data/markdown/dict-al-qamus-al-muhit-complete-writing-foundations.md"
    ],
    "duplicate_keys": {
      "normalized_title": "القاموس المحيط",
      "normalized_author": "مجد الدين الفيروزابادي",
      "content_sha256": "c7ddbd6247b3f4dc3a7f9df530aa233e03053803083f1c0152caf4972ba0e839"
    },
    "provenance": {
      "discovered_at": "2026-05-21",
      "discovery_method": "قائمة تأسيسية يدوية؛ تحقق عبر واجهة ويكي مصدر API",
      "verified_by": "Hermes"
    }
  },
  {
    "id": "dict-mukhtar-al-sihah",
    "title": "مختار الصحاح",
    "author": "محمد بن أبي بكر الرازي",
    "category": "dictionary",
    "source_type": "html",
    "language_stage": "classical",
    "status": "synthesized",
    "original_url": "https://ar.wikisource.org/wiki/%D9%85%D8%AE%D8%AA%D8%A7%D8%B1_%D8%A7%D9%84%D8%B5%D8%AD%D8%A7%D8%AD",
    "mirror_urls": [
      "https://ar.wikisource.org/wiki/%D9%85%D8%AE%D8%AA%D8%A7%D8%B1_%D8%A7%D9%84%D8%B5%D8%AD%D8%A7%D8%AD/%D8%A8%D8%A7%D8%A8_%D8%A7%D9%84%D8%A8%D8%A7%D8%A1",
      "https://ar.wikisource.org/wiki/%D9%85%D8%AE%D8%AA%D8%A7%D8%B1_%D8%A7%D9%84%D8%B5%D8%AD%D8%A7%D8%AD/%D8%A8%D8%A7%D8%A8_%D8%A7%D9%84%D9%81%D8%A7%D8%A1",
      "https://ar.wikisource.org/wiki/%D9%85%D8%AE%D8%AA%D8%A7%D8%B1_%D8%A7%D9%84%D8%B5%D8%AD%D8%A7%D8%AD/%D8%A8%D8%A7%D8%A8_%D8%A7%D9%84%D9%88%D8%A7%D9%88",
      "https://ar.wikisource.org/wiki/%D9%85%D8%AE%D8%AA%D8%A7%D8%B1_%D8%A7%D9%84%D8%B5%D8%AD%D8%A7%D8%AD/%D8%A8%D8%A7%D8%A8_%D8%A7%D9%84%D9%83%D8%A7%D9%81",
      "https://ar.wikisource.org/wiki/%D9%85%D8%AE%D8%AA%D8%A7%D8%B1_%D8%A7%D9%84%D8%B5%D8%AD%D8%A7%D8%AD/%D8%A8%D8%A7%D8%A8_%D8%A7%D9%84%D9%82%D8%A7%D9%81",
      "https://ar.wikisource.org/wiki/%D9%85%D8%AE%D8%AA%D8%A7%D8%B1_%D8%A7%D9%84%D8%B5%D8%AD%D8%A7%D8%AD/%D8%A8%D8%A7%D8%A8_%D8%A7%D9%84%D8%AC%D9%8A%D9%85",
      "https://ar.wikisource.org/wiki/%D9%85%D8%AE%D8%AA%D8%A7%D8%B1_%D8%A7%D9%84%D8%B5%D8%AD%D8%A7%D8%AD/%D8%A8%D8%A7%D8%A8_%D8%A7%D9%84%D9%84%D8%A7%D9%85",
      "https://ar.wikisource.org/wiki/%D9%85%D8%AE%D8%AA%D8%A7%D8%B1_%D8%A7%D9%84%D8%B5%D8%AD%D8%A7%D8%AD/%D8%A8%D8%A7%D8%A8_%D8%A7%D9%84%D8%B9%D9%8A%D9%86",
      "https://ar.wikisource.org/wiki/%D9%85%D8%AE%D8%AA%D8%A7%D8%B1_%D8%A7%D9%84%D8%B5%D8%AD%D8%A7%D8%AD/%D8%A8%D8%A7%D8%A8_%D8%A7%D9%84%D8%AA%D8%A7%D8%A1",
      "https://ar.wikisource.org/wiki/%D9%85%D8%AE%D8%AA%D8%A7%D8%B1_%D8%A7%D9%84%D8%B5%D8%AD%D8%A7%D8%AD/%D8%A8%D8%A7%D8%A8_%D8%A7%D9%84%D8%AB%D8%A7%D8%A1",
      "https://ar.wikisource.org/wiki/%D9%85%D8%AE%D8%AA%D8%A7%D8%B1_%D8%A7%D9%84%D8%B5%D8%AD%D8%A7%D8%AD/%D8%A8%D8%A7%D8%A8_%D8%A7%D9%84%D8%AD%D8%A7%D8%A1",
      "https://ar.wikisource.org/wiki/%D9%85%D8%AE%D8%AA%D8%A7%D8%B1_%D8%A7%D9%84%D8%B5%D8%AD%D8%A7%D8%AD/%D8%A8%D8%A7%D8%A8_%D8%A7%D9%84%D8%AF%D8%A7%D9%84",
      "https://ar.wikisource.org/wiki/%D9%85%D8%AE%D8%AA%D8%A7%D8%B1_%D8%A7%D9%84%D8%B5%D8%AD%D8%A7%D8%AD/%D8%A8%D8%A7%D8%A8_%D8%A7%D9%84%D8%B1%D8%A7%D8%A1",
      "https://ar.wikisource.org/wiki/%D9%85%D8%AE%D8%AA%D8%A7%D8%B1_%D8%A7%D9%84%D8%B5%D8%AD%D8%A7%D8%AD/%D8%A8%D8%A7%D8%A8_%D8%A7%D9%84%D8%B3%D9%8A%D9%86",
      "https://ar.wikisource.org/wiki/%D9%85%D8%AE%D8%AA%D8%A7%D8%B1_%D8%A7%D9%84%D8%B5%D8%AD%D8%A7%D8%AD/%D8%A8%D8%A7%D8%A8_%D8%A7%D9%84%D8%B4%D9%8A%D9%86",
      "https://ar.wikisource.org/wiki/%D9%85%D8%AE%D8%AA%D8%A7%D8%B1_%D8%A7%D9%84%D8%B5%D8%AD%D8%A7%D8%AD/%D8%A8%D8%A7%D8%A8_%D8%A7%D9%84%D9%87%D9%85%D8%B2%D8%A9",